acmi_id,acmi_name,wikidata_id,wikidata_name,acmi_title,wikidata_title,match
7264,MEGAN MCMURCHY,Q15710480,MEGHAN MCCARTHY,ENDO WHAT?,MY LITTLE PONY: THE MOVIE,24
7264,MEGAN MCMURCHY,Q15710480,MEGHAN MCCARTHY,SADNESS: A MONOLOGUE BY WILLIAM YANG,MY LITTLE PONY: THE MOVIE,24
7264,MEGAN MCMURCHY,Q15710480,MEGHAN MCCARTHY,TALK,MY LITTLE PONY: EQUESTRIA GIRLS,18
7264,MEGAN MCMURCHY,Q15710480,MEGHAN MCCARTHY,FOR LOVE OR MONEY: A HISTORY OF WOMEN AND WORK IN AUSTRALIA,MY LITTLE PONY: EQUESTRIA GIRLS,39
7264,MEGAN MCMURCHY,Q15710480,MEGHAN MCCARTHY,"LET ME DIE, AGAIN",MY LITTLE PONY: EQUESTRIA GIRLS,35
