acmi_id,acmi_name,wikidata_id,wikidata_name,acmi_title,wikidata_title,match
8652,SOPHIA TURKIEWICZ,Q9339626,SOPHIA TURKIEWICZ,A HANDFUL OF JELLY BABIES,I'VE COME ABOUT THE SUICIDE,31
8652,SOPHIA TURKIEWICZ,Q9339626,SOPHIA TURKIEWICZ,LETTERS FROM POLAND,I'VE COME ABOUT THE SUICIDE,30
8652,SOPHIA TURKIEWICZ,Q9339626,SOPHIA TURKIEWICZ,SILVER CITY,SILVER CITY,100
8652,SOPHIA TURKIEWICZ,Q9339626,SOPHIA TURKIEWICZ,"LETTERS FROM POLAND: SYDNEY, NOVEMBER, 1950",I'VE COME ABOUT THE SUICIDE,30
8652,SOPHIA TURKIEWICZ,Q26831140,IAN MARKIEWICZ,A HANDFUL OF JELLY BABIES,LUCHA MEXICO,22
8652,SOPHIA TURKIEWICZ,Q26831140,IAN MARKIEWICZ,LETTERS FROM POLAND,LUCHA MEXICO,6
8652,SOPHIA TURKIEWICZ,Q26831140,IAN MARKIEWICZ,SILVER CITY,LUCHA MEXICO,17
8652,SOPHIA TURKIEWICZ,Q26831140,IAN MARKIEWICZ,"LETTERS FROM POLAND: SYDNEY, NOVEMBER, 1950",LUCHA MEXICO,8
