acmi_id,acmi_name,wikidata_id,wikidata_name,acmi_title,wikidata_title,match
14932,JENI THORNLEY,Q332046,KEN THORNE,FOR LOVE OR MONEY: A HISTORY OF WOMEN AND WORK IN AUSTRALIA,LIZ: THE ELIZABETH TAYLOR STORY,36
14932,JENI THORNLEY,Q332046,KEN THORNE,A FILM FOR DISCUSSION,SINFUL DAVEY,42
14932,JENI THORNLEY,Q332046,KEN THORNE,MAIDENS,MASTER SPY,47
14932,JENI THORNLEY,Q15153766,KEN THORLEY,FOR LOVE OR MONEY: A HISTORY OF WOMEN AND WORK IN AUSTRALIA,THE ADVENTURES OF GALGAMETH,26
14932,JENI THORNLEY,Q15153766,KEN THORLEY,A FILM FOR DISCUSSION,THE ADVENTURES OF GALGAMETH,17
14932,JENI THORNLEY,Q15153766,KEN THORLEY,MAIDENS,THE ADVENTURES OF GALGAMETH,29
