acmi_id,acmi_name,wikidata_id,wikidata_name,acmi_title,wikidata_title,match
18589,ALVIN YUDKOFF,Q2840609,ALVIN WYCKOFF,OUT OF SLAVERY: 1619-1860,LILY OF THE DUST,35
18589,ALVIN YUDKOFF,Q2840609,ALVIN WYCKOFF,CIVIL WAR AND RECONSTRUCTION: 1861-1877,MARIA ROSA,29
18589,ALVIN YUDKOFF,Q2840609,ALVIN WYCKOFF,OPERATION VENUS,THE CHEAT,42
18589,ALVIN YUDKOFF,Q2840603,ALVIN RAKOFF,OUT OF SLAVERY: 1619-1860,A KISS IS JUST A KISS,31
18589,ALVIN YUDKOFF,Q2840603,ALVIN RAKOFF,CIVIL WAR AND RECONSTRUCTION: 1861-1877,MR. HALPERN AND MR. JOHNSON,41
18589,ALVIN YUDKOFF,Q2840603,ALVIN RAKOFF,OPERATION VENUS,THE EMPEROR JONES,44
