acmi_id,acmi_name,wikidata_id,wikidata_name,acmi_title,wikidata_title,match
24164,ACORN FILMS,Q21686585,MARCO WILMS,EDUCATING RITA,EIN TRAUM IN ERDBEERFOLIE,41
24164,ACORN FILMS,Q21686585,MARCO WILMS,HEREDITY. - 2ND ED.,EIN TRAUM IN ERDBEERFOLIE,45
24164,ACORN FILMS,Q21686585,MARCO WILMS,LEARNING TO READ MAPS. - 2ND ED.,TAILOR MADE DREAMS,43
24164,ACORN FILMS,Q21686585,MARCO WILMS,TYPING: GETTING TO KNOW THE TYPEWRITER,METAL POLITICS TAIWAN,28
24164,ACORN FILMS,Q21686585,MARCO WILMS,MEIOSIS. - 2ND ED.,TAILOR MADE DREAMS,44
