acmi_id,acmi_name,wikidata_id,wikidata_name,acmi_title,wikidata_title,match
24139,IRENE FEUZ,Q3426199,RENE FLEUR,WAITING FOR BILL,NIGHT WARNING,48
24139,IRENE FEUZ,Q10303575,IRENE CRUZ,WAITING FOR BILL,RETALHOS DA VIDA DE UM MEDICO,22
24139,IRENE FEUZ,Q95671359,IRENE FALKE,WAITING FOR BILL,DAS SEX-ABITUR - HEISSE LIEBE IN BLUE JEANS,28
24139,IRENE FEUZ,Q3801893,IRENE FERRI,WAITING FOR BILL,WHAT GIRLS NEVER SAY,44
24139,IRENE FEUZ,Q107092148,IRENE BELZA,WAITING FOR BILL,LAS HORAS DEL DIA,36
24139,IRENE FEUZ,Q89045251,IRENE BLECUA,WAITING FOR BILL,TENGO GANAS DE TI,30
