acmi_id,acmi_name,wikidata_id,wikidata_name,acmi_title,wikidata_title,match
34156,KARL KRUSZELNICKI,Q1732094,KARL KUNZEL,GREAT MOMENTS IN SCIENCE: PRESENTED BY DR KARL KRUSZELNICKI,THE HEART MUST BE SILENT,34
34156,KARL KRUSZELNICKI,Q1732094,KARL KUNZEL,ARROW UP YOURS,THE HEART MUST BE SILENT,32
34156,KARL KRUSZELNICKI,Q1732094,KARL KUNZEL,MURPHY'S LAW,LAST STOP,38
34156,KARL KRUSZELNICKI,Q1732094,KARL KUNZEL,MANHOLE COVER: FIRST IN SPACE,THE HEART MUST BE SILENT,42
34156,KARL KRUSZELNICKI,Q13028258,ALEH GRUSZECKI,GREAT MOMENTS IN SCIENCE: PRESENTED BY DR KARL KRUSZELNICKI,GARASH,12
34156,KARL KRUSZELNICKI,Q13028258,ALEH GRUSZECKI,ARROW UP YOURS,GARASH,30
34156,KARL KRUSZELNICKI,Q13028258,ALEH GRUSZECKI,MURPHY'S LAW,GARASH,33
34156,KARL KRUSZELNICKI,Q13028258,ALEH GRUSZECKI,MANHOLE COVER: FIRST IN SPACE,GARASH,18
