acmi_id,acmi_name,wikidata_id,wikidata_name,acmi_title,wikidata_title,match
75621,EUNICE MACAULAY,Q103578,MACAULAY CULKIN,LUCRETIA: A POEM BY PETER DESBARATS,WRESTLING ISN'T WRESTLING,34
75621,EUNICE MACAULAY,Q103578,MACAULAY CULKIN,SPECIAL DELIVERY,GETTING EVEN WITH DAD,38
75621,EUNICE MACAULAY,Q103578,MACAULAY CULKIN,BLACKBERRY SUBWAY JAM,JACOB'S LADDER,40
75621,EUNICE MACAULAY,Q1677827,JACQUELINE MACAULAY,LUCRETIA: A POEM BY PETER DESBARATS,AMEISEN GEHEN ANDERE WEGE,37
75621,EUNICE MACAULAY,Q1677827,JACQUELINE MACAULAY,SPECIAL DELIVERY,AMEISEN GEHEN ANDERE WEGE,24
75621,EUNICE MACAULAY,Q1677827,JACQUELINE MACAULAY,BLACKBERRY SUBWAY JAM,THE READER,26
