acmi_id,acmi_name,wikidata_id,wikidata_name,acmi_title,wikidata_title,match
74787,ROSS MCCONNELL,Q6896443,MOLLIE MCCONNELL,HELP IS,"GO WEST, YOUNG MAN",17
74787,ROSS MCCONNELL,Q6896443,MOLLIE MCCONNELL,EVERY SQUARE INCH,"GO WEST, YOUNG MAN",18
74787,ROSS MCCONNELL,Q318297,ROSS MACDONALD,HELP IS,HARPER,31
74787,ROSS MCCONNELL,Q318297,ROSS MACDONALD,EVERY SQUARE INCH,THE DROWNING POOL,29
74787,ROSS MCCONNELL,Q22102086,ROSS LOWELL,HELP IS,WHILE I RUN THIS RACE,21
74787,ROSS MCCONNELL,Q22102086,ROSS LOWELL,EVERY SQUARE INCH,WHILE I RUN THIS RACE,11
74787,ROSS MCCONNELL,Q5157993,CON O'NEILL,HELP IS,DANCIN' THRU THE DARK,22
74787,ROSS MCCONNELL,Q5157993,CON O'NEILL,EVERY SQUARE INCH,TELSTAR: THE JOE MEEK STORY,42
74787,ROSS MCCONNELL,Q1335112,ROSS MCCALL,HELP IS,GREEN STREET,32
74787,ROSS MCCONNELL,Q1335112,ROSS MCCALL,EVERY SQUARE INCH,GREEN STREET,48
74787,ROSS MCCONNELL,Q51808923,RAMELL ROSS,HELP IS,"HALE COUNTY THIS MORNING, THIS EVENING",23
74787,ROSS MCCONNELL,Q51808923,RAMELL ROSS,EVERY SQUARE INCH,"HALE COUNTY THIS MORNING, THIS EVENING",30
