acmi_id,acmi_name,wikidata_id,wikidata_name,acmi_title,wikidata_title,match
83751,EDWIN WHITING,Q323060,JOHN WHITING,THE PORT MOB,YOUNG CASSIDY,8
83751,EDWIN WHITING,Q323060,JOHN WHITING,DIGITAL STORYTELLING WORKSHOP : GENERAL PUBLIC (MARCH 2007),YOUNG CASSIDY,12
83751,EDWIN WHITING,Q545996,LEONARD WHITING,THE PORT MOB,THE ROYAL HUNT OF THE SUN,38
83751,EDWIN WHITING,Q545996,LEONARD WHITING,DIGITAL STORYTELLING WORKSHOP : GENERAL PUBLIC (MARCH 2007),"INFANZIA, VOCAZIONE E PRIME ESPERIENZE DI GIACOMO CASANOVA, VENEZIANO",26
83751,EDWIN WHITING,Q5346814,EDWIN SHERIN,THE PORT MOB,MY OLD MAN'S PLACE,33
83751,EDWIN WHITING,Q5346814,EDWIN SHERIN,DIGITAL STORYTELLING WORKSHOP : GENERAL PUBLIC (MARCH 2007),A MARRIAGE: GEORGIA O'KEEFFE AND ALFRED STIEGLITZ,35
83751,EDWIN WHITING,Q1294687,EDWIN HONIG,THE PORT MOB,FIRST COUSIN ONCE REMOVED,16
83751,EDWIN WHITING,Q1294687,EDWIN HONIG,DIGITAL STORYTELLING WORKSHOP : GENERAL PUBLIC (MARCH 2007),FIRST COUSIN ONCE REMOVED,22
