acmi_id,acmi_name,wikidata_id,wikidata_name,acmi_title,wikidata_title,match
83749,SUE SILK,Q3502955,SUE KIEL,THE LETTER,STRAIGHT TO HELL,38
83749,SUE SILK,Q3502955,SUE KIEL,STORIES OF PEOPLE AND PLACE,STRAIGHT TO HELL,33
83749,SUE SILK,Q3502955,SUE KIEL,DIGITAL STORYTELLING WORKSHOP : GENERAL PUBLIC (MARCH 2007),DOWN AND OUT IN BEVERLY HILLS,21
83749,SUE SILK,Q739458,SILKE,THE LETTER,EARTH,53
83749,SUE SILK,Q739458,SILKE,STORIES OF PEOPLE AND PLACE,"HI, ARE YOU ALONE?",37
83749,SUE SILK,Q739458,SILKE,DIGITAL STORYTELLING WORKSHOP : GENERAL PUBLIC (MARCH 2007),"HI, ARE YOU ALONE?",28
